AcquisitionDate,link,title,publishedDate,authors,Key_dispersion relation,Key_distance conjecture,Key_EFT,Key_holographic QCD,Key_landscape,Key_Positivity,Key_Regge,Key_Swampland,Key_Weak Gravity
2022-09-08,http://arxiv.org/abs/2209.00510v1,Connecting Seesaw Effective Field Theory to Full Theory via Flavor Invariants,2022-09-01 14:54:20+00:00,"Bingrong Yu,Shun Zhou",False,False,True,False,False,False,False,False,False
2022-09-07,http://arxiv.org/abs/2209.00008v1,Detectors in weakly-coupled field theories,2022-08-31 18:00:00+00:00,"Simon Caron-Huot,Murat Kologlu,Petr Kravchuk,David Meltzer,David Simmons-Duffin",False,False,False,False,False,False,True,False,False
2022-09-07,http://arxiv.org/abs/2209.00013v1,The Penrose Inequality as a Constraint on the Low Energy Limit of Quantum Gravity,2022-08-31 18:00:00+00:00,Åsmund Folkestad,False,False,False,False,False,False,False,True,False
2022-09-06,http://arxiv.org/abs/2208.14462v1,(Quasi-) de Sitter solutions across dimensions and the TCC bound,2022-08-30 18:00:05+00:00,"David Andriot,Ludwig Horer",False,True,False,False,False,False,False,True,False
2022-09-05,http://arxiv.org/abs/2208.13872v1,Back-to-back inclusive dijets in DIS at small $x$: Sudakov suppression and gluon saturation at NLO,2022-08-29 20:35:05+00:00,"Paul Caucal,Farid Salazar,Björn Schenke,Raju Venugopalan",False,False,True,False,False,False,False,False,False
2022-09-03,http://arxiv.org/abs/2208.13093v1,Scalar Weak Gravity Conjecture and Inflationary Models,2022-08-27 22:20:21+00:00,"J. Sadeghi,M. R. Alipour,S. Noori Gashti",False,False,False,False,False,False,False,True,True
2022-09-02,http://arxiv.org/abs/2208.12631v1,Positivity bounds in vector theories,2022-08-26 12:46:01+00:00,"Claudia de Rham,Laura Engelbrecht,Lavinia Heisenberg,Alice Lüscher",False,False,False,False,False,True,False,False,False
2022-09-01,http://arxiv.org/abs/2208.12273v1,On Continuum Effective Field Theories and Gravity,2022-08-25 18:00:01+00:00,"Sylvain Fichet,Eugenio Megias,Mariano Quiros",False,False,True,False,False,False,False,False,False
2022-09-01,http://arxiv.org/abs/2208.12239v1,Asymmetric particle-antiparticle Dirac equation: second quantization,2022-08-25 17:43:27+00:00,Gustavo Rigolin,True,False,False,False,False,False,False,False,False
2022-08-30,http://arxiv.org/abs/2208.11179v1,"Celestial chiral algebras, colour-kinematics duality and integrability",2022-08-23 20:14:33+00:00,Ricardo Monteiro,False,False,True,False,False,False,False,False,False
2022-08-29,http://arxiv.org/abs/2208.10396v1,The Big Bang as a Mirror: a Solution of the Strong CP Problem,2022-08-22 15:26:14+00:00,"Latham Boyle,Martin Teuscher,Neil Turok",False,False,True,False,False,False,False,False,False
2022-08-26,http://arxiv.org/abs/2208.09194v1,On global behaviour of classical effective field theories,2022-08-19 07:37:21+00:00,Istvan Kadar,False,False,True,False,False,False,False,False,False
2022-08-25,http://arxiv.org/abs/2208.08989v1,Asymptotic Scalar Field Cosmology in String Theory,2022-08-18 17:59:53+00:00,Tom Rudelius,False,True,False,False,False,False,False,False,False
2022-08-24,http://arxiv.org/abs/2208.08504v1,Constraints on cosmological parameters in light of the scalar-tensor theory of gravity and swampland conjectures,2022-08-17 19:51:40+00:00,"S. Noori Gashti,J. Sadeghi",False,False,False,False,False,False,False,True,False
2022-08-24,http://arxiv.org/abs/2208.08459v2,Black Hole Tidal Love Numbers and Dissipation Numbers in Worldline Effective Field Theory,2022-08-17 18:01:04+00:00,"Mikhail M. Ivanov,Zihan Zhou",False,False,True,False,False,False,False,False,False
2022-08-24,http://arxiv.org/abs/2208.08444v1,Infinite Distances and Factorization,2022-08-17 18:00:00+00:00,John Stout,False,True,False,False,False,False,False,True,False
2022-08-22,http://arxiv.org/abs/2208.07409v1,Universal lifting in the D1-D5 CFT,2022-08-15 19:18:37+00:00,"Bin Guo,Marcel R. R. Hughes,Samir D. Mathur,Madhur Mehta",False,False,True,False,False,False,False,False,False
2022-08-22,http://arxiv.org/abs/2208.07000v1,The Structure of the ${\cal N}=4$ Supersymmetric Linear $W_{\infty}[λ]$ Algebra,2022-08-15 04:16:19+00:00,Changhyun Ahn,False,False,True,False,False,False,False,False,False
2022-08-18,http://arxiv.org/abs/2208.05930v1,Updated constraints from the effective field theory analysis of BOSS power spectrum on Early Dark Energy,2022-08-11 17:07:47+00:00,"Théo Simon,Pierre Zhang,Vivian Poulin,Tristan L. Smith",False,False,True,False,False,False,False,False,False
2022-08-18,http://arxiv.org/abs/2208.05929v1,On the consistency of effective field theory analyses of BOSS power spectrum,2022-08-11 17:07:44+00:00,"Théo Simon,Pierre Zhang,Vivian Poulin,Tristan L. Smith",False,False,True,False,False,False,False,False,False
2022-08-18,http://arxiv.org/abs/2208.05886v1,"Amplitudes, Hopf algebras and the colour-kinematics duality",2022-08-11 15:40:39+00:00,"Andreas Brandhuber,Graham R. Brown,Gang Chen,Joshua Gowdy,Gabriele Travaglini,Congkao Wen",False,False,True,False,False,False,False,False,False
2022-08-18,http://arxiv.org/abs/2208.05646v1,Nonrelativistic expansion of M2 branes and M theory backgrounds,2022-08-11 05:28:57+00:00,Dibakar Roychowdhury,True,False,False,False,False,False,False,False,False
2022-08-16,http://arxiv.org/abs/2208.04864v1,Topological Superconductor from the Quantum Hall Phase: Effective Field Theory Description,2022-08-09 15:54:14+00:00,"M. Gomes,Pedro R. S. Gomes,K. Raimundo,Rodrigo Corso B. Santos,A. J. da Silva",True,False,False,False,False,False,False,False,False
2022-08-15,http://arxiv.org/abs/2208.04723v1,Dynamical dark energy models from a new Hubble parameter in $f(Q)$ gravity,2022-08-08 11:19:03+00:00,"M. Koussour,S. K. J. Pacif,M. Bennai,P. K. Sahoo",False,False,True,False,False,False,False,False,False
2022-08-12,http://arxiv.org/abs/2208.02943v1,Generalized Regge-Wheeler Equation from Effective Field Theory of Black Hole Perturbations with a Timelike Scalar Profile,2022-08-05 00:45:17+00:00,"Shinji Mukohyama,Kazufumi Takahashi,Vicharit Yingcharoenrat",False,False,True,False,False,False,True,False,False
2022-08-11,http://arxiv.org/abs/2208.02823v1,Stability of Hairy Black Holes in Shift-Symmetric Scalar-Tensor Theories via the Effective Field Theory Approach,2022-08-04 18:00:00+00:00,"Justin Khoury,Toshifumi Noumi,Mark Trodden,Sam S. C. Wong",False,False,True,False,False,False,False,False,False
2022-08-11,http://arxiv.org/abs/2208.02741v1,Energy-Momentum Complex in Higher Order Curvature-Based Local Gravity,2022-08-04 16:17:51+00:00,"Salvatore Capozziello,Maurizio Capriolo,Gaetano Lambiase",False,False,True,False,False,False,False,False,False
2022-08-11,http://arxiv.org/abs/2208.02735v1,On the positivity of Coon amplitude in D=4,2022-08-04 16:09:17+00:00,"Joydeep Chakravarty,Pronobesh Maity,Amiya Mishra",False,False,False,False,False,True,True,False,False
2022-08-11,http://arxiv.org/abs/2208.02604v1,Cornell potential in generalized Soft Wall holographic model,2022-08-04 12:10:12+00:00,"Sergey Afonin,Timofey Solomko",False,False,False,False,False,False,True,False,False
2022-08-10,http://arxiv.org/abs/2208.02281v1,Scattering Amplitudes and N-Body Post-Minkowskian Hamiltonians in General Relativity and Beyond,2022-08-03 18:04:35+00:00,"Callum R. T. Jones,Mikhail Solon",False,False,True,False,False,False,False,False,False
2022-08-09,http://arxiv.org/abs/2208.01656v1,Dimensional Reduction of Cobordism and K-theory,2022-08-02 18:00:03+00:00,"Ralph Blumenhagen,Niccolò Cribiori,Christian Kneissl,Andriana Makridou",False,False,False,False,False,False,False,True,False
2022-08-09,http://arxiv.org/abs/2208.01629v1,"From Celestial Correlators to AdS, and back",2022-08-02 17:57:33+00:00,"Lorenzo Iacobacci,Charlotte Sleight,Massimo Taronna",False,False,True,False,False,True,False,False,False
2022-08-09,http://arxiv.org/abs/2208.01571v1,Tensor network approach to 2d Lorentzian quantum Regge calculus,2022-08-02 16:18:49+00:00,"Yoshiyasu Ito,Daisuke Kadoh,Yuki Sato",False,False,False,False,False,False,True,False,False
2022-08-08,http://arxiv.org/abs/2208.01057v1,The Dark Dimension in a Warped Throat,2022-08-01 18:00:09+00:00,"Ralph Blumenhagen,Max Brinkmann,Andriana Makridou",False,True,False,False,True,False,False,True,False
2022-08-06,http://arxiv.org/abs/2208.00266v1,"Universal enveloping algebras of Lie-Rinehart algebras: crossed products, connections, and curvature",2022-07-30 16:15:22+00:00,"Xavier Bekaert,Niels Kowalzig,Paolo Saracco",False,False,True,False,False,False,False,False,False
2022-08-05,http://arxiv.org/abs/2208.00009v1,The Asymptotic Weak Gravity Conjecture for Open Strings,2022-07-29 18:00:00+00:00,"Cesar Fierro Cota,Alessandro Mininno,Timo Weigand,Max Wiesner",False,False,True,False,False,False,False,False,True
2022-08-05,http://arxiv.org/abs/2207.14778v1,Symmetric-hyperbolic quasi-hydrodynamics,2022-07-29 16:41:42+00:00,"Lorenzo Gavassino,Marco Antonelli,Brynmor Haskell",True,False,False,False,False,False,False,False,False
2022-08-04,http://arxiv.org/abs/2207.14319v1,Gauge symmetry breaking with fluxes and natural Standard Model structure from exceptional GUTs in F-theory,2022-07-28 18:00:05+00:00,"Shing Yan Li,Washington Taylor",False,False,False,False,True,False,False,False,False
2022-08-04,http://arxiv.org/abs/2207.14285v1,New instabilities for non-supersymmetric AdS$_4$ orientifold vacua,2022-07-28 17:59:02+00:00,"Fernando Marchesano,Joan Quirant,Matteo Zatti",False,False,False,False,False,False,False,False,True
2022-08-04,http://arxiv.org/abs/2207.14272v1,Dynamical chiral magnetic current and instability in Weyl semimetals,2022-07-28 17:53:41+00:00,"Tatsuya Amitani,Yusuke Nishida",True,False,False,False,False,False,False,False,False
2022-08-04,http://arxiv.org/abs/2207.14224v1,Positivity bounds on effective field theories with spontaneously broken Lorentz invariance,2022-07-28 16:44:48+00:00,"Paolo Creminelli,Oliver Janssen,Leonardo Senatore",False,False,True,False,False,True,False,False,False
2022-08-03,http://arxiv.org/abs/2207.13750v1,Mapping Markov: On effective master equations for two accelerated qubits,2022-07-27 19:07:23+00:00,"Greg Kaplanek,Erickson Tjoa",False,False,False,False,False,True,False,False,False
2022-08-03,http://arxiv.org/abs/2207.13593v1,Higgs in Nilpotent Supergravity: Vacuum Energy and Festina Lente,2022-07-27 15:52:32+00:00,"Amineh Mohseni,Mahdi Torabian",False,False,False,False,False,False,False,True,False
2022-08-02,http://arxiv.org/abs/2207.13022v1,Fast Scrambling of Mutual Information in Kerr-AdS$_4$,2022-07-26 16:34:46+00:00,"Vinay Malvimat,Rohan R. Poojary",False,False,True,False,False,False,False,False,False
2022-08-02,http://arxiv.org/abs/2207.12772v1,$U_q\mathfrak{sl}_2$-invariant non-compact boundary conditions for the XXZ spin chain,2022-07-26 09:41:46+00:00,"Dmitry Chernyak,Azat M. Gainutdinov,Hubert Saleur",False,False,True,False,False,False,False,False,False
2022-08-01,http://arxiv.org/abs/2207.12448v1,Nonperturbative Bounds on Scattering of Massive Scalar Particles in $d \geq 2$,2022-07-25 18:03:25+00:00,"Hongbin Chen,A. Liam Fitzpatrick,Denis Karateev",False,False,True,False,False,True,False,False,False
2022-08-01,http://arxiv.org/abs/2207.12364v1,Confinement in de Sitter Space and the Swampland,2022-07-25 17:25:29+00:00,Rashmish K. Mishra,False,False,False,False,False,False,False,True,False
2022-07-31,http://arxiv.org/abs/2207.11772v1,Perturbative unitarity and NEC violation in genesis cosmology,2022-07-24 16:54:47+00:00,"Yong Cai,Ji Xu,Shuai Zhao,Siyi Zhou",False,False,True,False,False,False,False,False,False
2022-07-24,http://arxiv.org/abs/2207.10634v1,(Super)Universal Attractors and the de Sitter Vacua in String Landscape,2022-07-21 17:43:16+00:00,Omer Guleryuz,False,False,False,False,True,False,False,True,False
2022-07-24,http://arxiv.org/abs/2207.10088v1,QFitter -- A Quantum Fitting Framework Applied to Effective Field Theories,2022-07-20 18:00:00+00:00,"Juan Carlos Criado,Roman Kogler,Michael Spannowsky",False,False,True,False,False,False,False,False,False
2022-07-24,http://arxiv.org/abs/2207.09474v1,Conformal field theory for particle physicists,2022-07-19 18:00:04+00:00,Marc Gillioz,False,False,True,False,False,False,False,False,False
2022-07-24,http://arxiv.org/abs/2207.09449v1,Correlated Fractional Dirac Materials,2022-07-19 17:59:33+00:00,"Bitan Roy,Vladimir Juricic",False,False,False,False,True,False,False,False,False
2022-07-24,http://arxiv.org/abs/2207.09448v1,Swampland Bounds on Dark Sectors,2022-07-19 17:59:30+00:00,"Miguel Montero,Julian B. Muñoz,Georges Obied",False,False,False,False,False,False,False,True,False
2022-07-24,http://arxiv.org/abs/2207.09275v1,IBP reduction via Gröbner bases in a rational double-shift algebra,2022-07-19 13:39:44+00:00,"Mohamed Barakat,Robin Brüser,Tobias Huber,Jan Piclum",False,False,True,False,False,False,False,False,False
2022-07-24,http://arxiv.org/abs/2207.08848v1,Gravitational Tunneling in Lorentz Violating Gravity,2022-07-18 18:00:13+00:00,"F. Del Porro,M. Herrero-Valea,S. Liberati,M. Schneider",True,False,False,False,False,False,False,False,False
2022-07-24,http://arxiv.org/abs/2207.08688v1,Dark Energy and Extending the Geodesic Equations of Motion: A Spectrum of Galactic Rotation Curves,2022-07-18 15:38:25+00:00,Achilles D. Speliotopoulos,False,False,False,False,False,False,False,False,True
2022-07-24,http://arxiv.org/abs/2207.08355v1,Flows into de Sitter from anisotropic initial conditions: An effective field theory approach,2022-07-18 02:36:56+00:00,"Feraz Azhar,David I. Kaiser",False,False,True,False,False,False,False,False,False
